{"allowed_claim_types":["STRICT_BLIND","HISTORICAL_BLIND"],"claim_track":"BLIND","eligibility_manifest_hash":"63c3ff000edf1935c2b00dc0a9b5dbbf87f6705bccfa4f80a55c110a99af14e4","experiment_id":"EZ-B003-v2-real-blind","federation_improvement_required":false,"protocol_qualified":true,"strict_gate":true,"threshold_manifest_hash":"fbc28d599088ec96fc1b2d817feeb75a1e4b371d2618e45236977f7125534eae"}
