{"allowed_claim_types":["STRICT_BLIND","HISTORICAL_BLIND"],"claim_track":"BLIND","eligibility_manifest_hash":"81b5874fe6a86e1ef15c41b030937d66d1c282f343de86e830fef55cda530fd5","experiment_id":"EZ-B002-v2-real-blind","federation_improvement_required":false,"protocol_qualified":true,"strict_gate":true,"threshold_manifest_hash":"de681506dba28c409921a9273a07be9e968747674b4dcaba48febe465c02f636"}
